{
  "vector": "1",
  "kind": "compile",
  "name": "template-contradiction",
  "status": "frozen",
  "generated_by": "cmd/vectorgen@dd3b61dd79ea",
  "description": "The built-in contradiction@1 alone on a route, with the SPEC §2.8 refund exchange (refund-policy.md in the system prompt). The state holds exactly the template's state_fields; params take their defaults; the one question is the template's question verbatim under contradiction__v1.",
  "input": {
    "route": {
      "evaluators": [{"ref": "contradiction@1"}],
      "on_no_evidence": "ignore",
      "evidence_sources": ["request_system", "request_context", "tool_results", "extension"],
      "client_rules": false,
      "model": "typesafe/jev-1.13"
    },
    "inputs": {
      "user_request": "Can I still get a refund on my annual plan? I bought it 45 days ago.",
      "assistant_response": "You can get a full refund within 60 days of purchase.",
      "system_instructions": "You are the Acme support assistant. Answer only from the documents below. If they do not cover the question, say so.",
      "evidence": [
        {
          "id": "refund-policy.md",
          "source": "request_system",
          "text": "Annual plans can be refunded within 30 days of purchase. Monthly plans are non-refundable."
        }
      ],
      "rules": {}
    },
    "budget": {
      "tokens": 24000,
      "cpt": 4,
      "max_questions": 16,
      "overhead": 275,
      "max_response_tokens": 6000,
      "evidence_max_tokens": 8000
    }
  },
  "expected": {
    "cpt": 4,
    "est_tokens": [453],
    "evaluators": [{"internal": false, "ref": "contradiction@1", "stage": "active"}],
    "excluded": [],
    "packed_ids": ["refund-policy.md"],
    "qid_request": {"contradiction__v1": 0},
    "question_map": {"contradiction__v1": "contradiction@1"},
    "question_set_sha256": "8c13ddf30948e05d2be1196080f0caa1e44ab3c2431d513b319673f0ef69a44d",
    "request_sha256": ["a4d82de2f0494464323c870ef388c87240060af2e23df57b78dd95dd14396b63"],
    "requests": [
      {
        "model": "typesafe/jev-1.13",
        "state": {
          "assistant_response": "You can get a full refund within 60 days of purchase.",
          "evidence": [
            {
              "id": "refund-policy.md",
              "source": "request_system",
              "text": "Annual plans can be refunded within 30 days of purchase. Monthly plans are non-refundable."
            }
          ]
        }
      }
    ],
    "truncated": false,
    "truncated_ids": []
  }
}
