{
  "vector": "1",
  "kind": "calibrate_fit",
  "name": "isotonic-risks-within-eps-pool-first",
  "status": "frozen",
  "generated_by": "cmd/vectorgen@4838e42e858b",
  "description": "Risks 0.4 and 0.4 + 5e-10 are within EPS, so they form one group [0.4, 0.4000000005] (1 pos, 1 neg) before PAV; 0.2 (neg) and 0.8 (pos) complete three increasing blocks 0, 0.5, 1. The table interpolates from the block ends: t[30] = 0.25, t[60] = R6(0.5 + 0.5·0.1999999995/0.3999999995) = 0.75.",
  "input": {
    "op": "isotonic",
    "samples": [
      {"risk_raw": 0.4, "label": true}, {"risk_raw": 0.4000000005, "label": false},
      {"risk_raw": 0.2, "label": false}, {"risk_raw": 0.8, "label": true}
    ]
  },
  "expected": {
    "blocks": [
      {"n": 1, "value": 0, "x_hi": 0.2, "x_lo": 0.2},
      {"n": 2, "value": 0.5, "x_hi": 0.4000000005, "x_lo": 0.4},
      {"n": 1, "value": 1, "x_hi": 0.8, "x_lo": 0.8}
    ],
    "table": [
      0, 0, 0, 0, 0, 0, 0, 0, 0, 0, 0, 0, 0, 0, 0, 0, 0, 0, 0, 0, 0, 0.025, 0.05, 0.075, 0.1, 0.125,
      0.15, 0.175, 0.2, 0.225, 0.25, 0.275, 0.3, 0.325, 0.35, 0.375, 0.4, 0.425, 0.45, 0.475, 0.5,
      0.5125, 0.525, 0.5375, 0.55, 0.5625, 0.575, 0.5875, 0.6, 0.6125, 0.625, 0.6375, 0.65, 0.6625,
      0.675, 0.6875, 0.7, 0.7125, 0.725, 0.7375, 0.75, 0.7625, 0.775, 0.7875, 0.8, 0.8125, 0.825,
      0.8375, 0.85, 0.8625, 0.875, 0.8875, 0.9, 0.9125, 0.925, 0.9375, 0.95, 0.9625, 0.975, 0.9875,
      1, 1, 1, 1, 1, 1, 1, 1, 1, 1, 1, 1, 1, 1, 1, 1, 1, 1, 1, 1, 1
    ]
  }
}
