{
  "vector": "1",
  "kind": "calibrate_fit",
  "name": "threshold-max-f1-precision-floor",
  "status": "frozen",
  "generated_by": "cmd/vectorgen@4838e42e858b",
  "description": "warn_at rule: max F1 with precision >= 0.8. Candidates 0.2 (TP 6, FP 2, precision 0.75, F1 12/14), 0.6 (TP 3, FP 1, precision 0.75), 0.8 (TP 2, FP 0, precision 1, F1 4/8). The floor removes 0.2 and 0.6, leaving 0.8.",
  "input": {
    "op": "threshold",
    "groups": [
      {"risk_raw": 0.2, "pos": 3, "neg": 1}, {"risk_raw": 0.6, "pos": 1, "neg": 1},
      {"risk_raw": 0.8, "pos": 2, "neg": 0}
    ],
    "objective": "max_f1",
    "min_precision": 0.8
  },
  "expected": {
    "result": {
      "f1": 0.5,
      "fn": 4,
      "fp": 0,
      "precision": 1,
      "recall": 0.3333333333333333,
      "threshold": 0.8,
      "tn": 2,
      "tp": 2
    }
  }
}
