{
  "vector": "1",
  "kind": "calibrate_fit",
  "name": "quick-isotonic-mapping-from-50-labels",
  "status": "frozen",
  "generated_by": "cmd/vectorgen@4838e42e858b",
  "description": "50 labels with at least 15 of each class: the mapping switches from Platt to PAV isotonic (blocks of the label shares, interpolated, R6-rounded); platt is null.",
  "input": {
    "op": "quick",
    "labeled": [
      {"risk_raw": 0.01, "label": false}, {"risk_raw": 0.03, "label": false},
      {"risk_raw": 0.05, "label": false}, {"risk_raw": 0.07, "label": false},
      {"risk_raw": 0.09, "label": false}, {"risk_raw": 0.11, "label": false},
      {"risk_raw": 0.13, "label": false}, {"risk_raw": 0.15, "label": false},
      {"risk_raw": 0.17, "label": false}, {"risk_raw": 0.19, "label": false},
      {"risk_raw": 0.21, "label": true}, {"risk_raw": 0.23, "label": false},
      {"risk_raw": 0.25, "label": false}, {"risk_raw": 0.27, "label": false},
      {"risk_raw": 0.29, "label": false}, {"risk_raw": 0.31, "label": true},
      {"risk_raw": 0.33, "label": false}, {"risk_raw": 0.35, "label": false},
      {"risk_raw": 0.37, "label": false}, {"risk_raw": 0.39, "label": false},
      {"risk_raw": 0.41, "label": true}, {"risk_raw": 0.43, "label": true},
      {"risk_raw": 0.45, "label": false}, {"risk_raw": 0.47, "label": false},
      {"risk_raw": 0.49, "label": false}, {"risk_raw": 0.51, "label": true},
      {"risk_raw": 0.53, "label": true}, {"risk_raw": 0.55, "label": false},
      {"risk_raw": 0.57, "label": false}, {"risk_raw": 0.59, "label": false},
      {"risk_raw": 0.61, "label": true}, {"risk_raw": 0.63, "label": true},
      {"risk_raw": 0.65, "label": true}, {"risk_raw": 0.67, "label": false},
      {"risk_raw": 0.69, "label": false}, {"risk_raw": 0.71, "label": true},
      {"risk_raw": 0.73, "label": true}, {"risk_raw": 0.75, "label": true},
      {"risk_raw": 0.77, "label": false}, {"risk_raw": 0.79, "label": false},
      {"risk_raw": 0.81, "label": true}, {"risk_raw": 0.83, "label": true},
      {"risk_raw": 0.85, "label": true}, {"risk_raw": 0.87, "label": true},
      {"risk_raw": 0.89, "label": false}, {"risk_raw": 0.91, "label": true},
      {"risk_raw": 0.93, "label": true}, {"risk_raw": 0.95, "label": true},
      {"risk_raw": 0.97, "label": true}, {"risk_raw": 0.99, "label": false}
    ]
  },
  "expected": {
    "enough": true,
    "grid": [
      {"fn": 0, "fp": 30, "threshold": 0.01, "tn": 0, "tp": 20},
      {"fn": 0, "fp": 29, "threshold": 0.03, "tn": 1, "tp": 20},
      {"fn": 0, "fp": 28, "threshold": 0.05, "tn": 2, "tp": 20},
      {"fn": 0, "fp": 27, "threshold": 0.07, "tn": 3, "tp": 20},
      {"fn": 0, "fp": 26, "threshold": 0.09, "tn": 4, "tp": 20},
      {"fn": 0, "fp": 25, "threshold": 0.11, "tn": 5, "tp": 20},
      {"fn": 0, "fp": 24, "threshold": 0.13, "tn": 6, "tp": 20},
      {"fn": 0, "fp": 23, "threshold": 0.15, "tn": 7, "tp": 20},
      {"fn": 0, "fp": 22, "threshold": 0.17, "tn": 8, "tp": 20},
      {"fn": 0, "fp": 21, "threshold": 0.19, "tn": 9, "tp": 20},
      {"fn": 0, "fp": 20, "threshold": 0.21, "tn": 10, "tp": 20},
      {"fn": 1, "fp": 20, "threshold": 0.23, "tn": 10, "tp": 19},
      {"fn": 1, "fp": 19, "threshold": 0.25, "tn": 11, "tp": 19},
      {"fn": 1, "fp": 18, "threshold": 0.27, "tn": 12, "tp": 19},
      {"fn": 1, "fp": 17, "threshold": 0.29, "tn": 13, "tp": 19},
      {"fn": 1, "fp": 16, "threshold": 0.31, "tn": 14, "tp": 19},
      {"fn": 2, "fp": 16, "threshold": 0.33, "tn": 14, "tp": 18},
      {"fn": 2, "fp": 15, "threshold": 0.35, "tn": 15, "tp": 18},
      {"fn": 2, "fp": 14, "threshold": 0.37, "tn": 16, "tp": 18},
      {"fn": 2, "fp": 13, "threshold": 0.39, "tn": 17, "tp": 18},
      {"fn": 2, "fp": 12, "threshold": 0.41, "tn": 18, "tp": 18},
      {"fn": 3, "fp": 12, "threshold": 0.43, "tn": 18, "tp": 17},
      {"fn": 4, "fp": 12, "threshold": 0.45, "tn": 18, "tp": 16},
      {"fn": 4, "fp": 11, "threshold": 0.47, "tn": 19, "tp": 16},
      {"fn": 4, "fp": 10, "threshold": 0.49, "tn": 20, "tp": 16},
      {"fn": 4, "fp": 9, "threshold": 0.51, "tn": 21, "tp": 16},
      {"fn": 5, "fp": 9, "threshold": 0.53, "tn": 21, "tp": 15},
      {"fn": 6, "fp": 9, "threshold": 0.55, "tn": 21, "tp": 14},
      {"fn": 6, "fp": 8, "threshold": 0.57, "tn": 22, "tp": 14},
      {"fn": 6, "fp": 7, "threshold": 0.59, "tn": 23, "tp": 14},
      {"fn": 6, "fp": 6, "threshold": 0.61, "tn": 24, "tp": 14},
      {"fn": 7, "fp": 6, "threshold": 0.63, "tn": 24, "tp": 13},
      {"fn": 8, "fp": 6, "threshold": 0.65, "tn": 24, "tp": 12},
      {"fn": 9, "fp": 6, "threshold": 0.67, "tn": 24, "tp": 11},
      {"fn": 9, "fp": 5, "threshold": 0.69, "tn": 25, "tp": 11},
      {"fn": 9, "fp": 4, "threshold": 0.71, "tn": 26, "tp": 11},
      {"fn": 10, "fp": 4, "threshold": 0.73, "tn": 26, "tp": 10},
      {"fn": 11, "fp": 4, "threshold": 0.75, "tn": 26, "tp": 9},
      {"fn": 12, "fp": 4, "threshold": 0.77, "tn": 26, "tp": 8},
      {"fn": 12, "fp": 3, "threshold": 0.79, "tn": 27, "tp": 8},
      {"fn": 12, "fp": 2, "threshold": 0.81, "tn": 28, "tp": 8},
      {"fn": 13, "fp": 2, "threshold": 0.83, "tn": 28, "tp": 7},
      {"fn": 14, "fp": 2, "threshold": 0.85, "tn": 28, "tp": 6},
      {"fn": 15, "fp": 2, "threshold": 0.87, "tn": 28, "tp": 5},
      {"fn": 16, "fp": 2, "threshold": 0.89, "tn": 28, "tp": 4},
      {"fn": 16, "fp": 1, "threshold": 0.91, "tn": 29, "tp": 4},
      {"fn": 17, "fp": 1, "threshold": 0.93, "tn": 29, "tp": 3},
      {"fn": 18, "fp": 1, "threshold": 0.95, "tn": 29, "tp": 2},
      {"fn": 19, "fp": 1, "threshold": 0.97, "tn": 29, "tp": 1},
      {"fn": 20, "fp": 1, "threshold": 0.99, "tn": 29, "tp": 0}
    ],
    "loo_range": [0.41, 0.61],
    "mapping": {
      "method": "isotonic",
      "platt": null,
      "table": [
        0, 0, 0, 0, 0, 0, 0, 0, 0, 0, 0, 0, 0, 0, 0, 0, 0, 0, 0, 0, 0.1, 0.2, 0.2, 0.2, 0.2, 0.2,
        0.2, 0.2, 0.2, 0.2, 0.2, 0.2, 0.2, 0.2, 0.2, 0.2, 0.2, 0.2, 0.2, 0.2, 0.3, 0.4, 0.4, 0.4,
        0.4, 0.4, 0.4, 0.4, 0.4, 0.4, 0.4, 0.4, 0.4, 0.4, 0.4, 0.4, 0.4, 0.4, 0.4, 0.4, 0.5, 0.6,
        0.6, 0.6, 0.6, 0.6, 0.6, 0.6, 0.6, 0.6, 0.6, 0.6, 0.6, 0.6, 0.6, 0.6, 0.6, 0.6, 0.6, 0.6,
        0.7, 0.8, 0.8, 0.8, 0.8, 0.8, 0.8, 0.8, 0.8, 0.8, 0.8, 0.8, 0.8, 0.8, 0.8, 0.8, 0.8, 0.8,
        0.8, 0.8, 0.8
      ]
    },
    "n": 50,
    "n_neg": 30,
    "n_pos": 20,
    "precision": {"ci95": [0.42320360253322475, 0.7540937188319815], "point": 0.6},
    "recall": {"ci95": [0.6989663547715128, 0.9721335187862319], "point": 0.9},
    "threshold": 0.41,
    "unstable": true
  }
}
